{
  "account_costs": [],
  "aws_cost_results": [],
  "azure_cost_results": [],
  "azure_service_costs": [],
  "azure_subscription_costs": [],
  "capacity_metric_results": [
    {
      "capacity_metric_result_id": "cmr-r8d-util",
      "capacity_totals_id": "ct-r8d-util",
      "capacity_window_id": "cw-r8d-clamped",
      "metric": "utilization",
      "group_by": "account-id",
      "period": {
        "start": "2026-11-16T00:00:00Z",
        "end": "2026-12-02T07:00:00Z"
      },
      "results": [
        {
          "dimension": "604215873390",
          "avg_utilization_pct": 38.2,
          "total_capacity_hrs": 2080.0,
          "unused_capacity_hrs": 1284.6,
          "total_estimated_cost_usd": 6334.9,
          "unused_estimated_cost_usd": 3912.48,
          "reservation_count": 5
        },
        {
          "dimension": "731508264117",
          "avg_utilization_pct": 65.8,
          "total_capacity_hrs": 2346.0,
          "unused_capacity_hrs": 802.2,
          "total_estimated_cost_usd": 6454.7,
          "unused_estimated_cost_usd": 2207.15,
          "reservation_count": 6
        },
        {
          "dimension": "289046137552",
          "avg_utilization_pct": 73.7,
          "total_capacity_hrs": 1564.0,
          "unused_capacity_hrs": 410.9,
          "total_estimated_cost_usd": 3685.0,
          "unused_estimated_cost_usd": 968.3,
          "reservation_count": 4
        },
        {
          "dimension": "815730492268",
          "avg_utilization_pct": 88.6,
          "total_capacity_hrs": 1173.0,
          "unused_capacity_hrs": 133.4,
          "total_estimated_cost_usd": 2214.8,
          "unused_estimated_cost_usd": 251.77,
          "reservation_count": 3
        }
      ],
      "totals": {
        "capacity_totals_id": "ct-r8d-util",
        "total_estimated_cost_usd": 18689.4,
        "unused_estimated_cost_usd": 7339.7,
        "overall_utilization_pct": 63.3,
        "total_dimensions": 4
      }
    },
    {
      "capacity_metric_result_id": "cmr-r8d-unused",
      "capacity_totals_id": "ct-r8d-unused",
      "capacity_window_id": "cw-r8d-clamped",
      "metric": "unused_cost",
      "group_by": "account-id",
      "period": {
        "start": "2026-11-16T00:00:00Z",
        "end": "2026-12-02T07:00:00Z"
      },
      "results": [
        {
          "dimension": "604215873390",
          "unused_capacity_hrs": 1284.6,
          "unused_estimated_cost_usd": 3912.48
        },
        {
          "dimension": "731508264117",
          "unused_capacity_hrs": 802.2,
          "unused_estimated_cost_usd": 2207.15
        },
        {
          "dimension": "289046137552",
          "unused_capacity_hrs": 410.9,
          "unused_estimated_cost_usd": 968.3
        },
        {
          "dimension": "815730492268",
          "unused_capacity_hrs": 133.4,
          "unused_estimated_cost_usd": 251.77
        }
      ],
      "totals": {
        "capacity_totals_id": "ct-r8d-unused",
        "total_estimated_cost_usd": 0.0,
        "unused_estimated_cost_usd": 7339.7,
        "overall_utilization_pct": 0.0,
        "total_dimensions": 4
      }
    }
  ],
  "capacity_totals": [
    {
      "capacity_totals_id": "ct-r8d-util",
      "total_estimated_cost_usd": 18689.4,
      "unused_estimated_cost_usd": 7339.7,
      "overall_utilization_pct": 63.3,
      "total_dimensions": 4
    },
    {
      "capacity_totals_id": "ct-r8d-unused",
      "total_estimated_cost_usd": 0.0,
      "unused_estimated_cost_usd": 7339.7,
      "overall_utilization_pct": 0.0,
      "total_dimensions": 4
    }
  ],
  "capacity_windows": [
    {
      "capacity_window_id": "cw-r8d-clamped",
      "start": "2026-11-16T00:00:00Z",
      "end": "2026-12-02T07:00:00Z"
    }
  ],
  "cost_monitor_results": [
    {
      "cost_monitor_result_id": "cmr-r8d-summary",
      "endpoint": "summary",
      "results": [
        {
          "provider": "aws",
          "service": "EC2-Instances",
          "month": "2026-10",
          "start_date": "2026-10-01",
          "end_date": "2026-10-31",
          "cost": 148602.35
        },
        {
          "provider": "aws",
          "service": "EC2-Instances",
          "month": "2026-11",
          "start_date": "2026-11-01",
          "end_date": "2026-11-30",
          "cost": 152917.8
        }
      ]
    }
  ],
  "gcp_cost_results": [],
  "periods": []
}
